<?xml version="1.0"?>
<xs:schema xmlns:xs="http://www.w3.org/2001/XMLSchema">
    <xs:element name="dssinhvien">
        <xs:complexType>
            <xs:sequence>
                <xs:element name="sinhvien" maxOccurs="unbounded">
                    <xs:complexType>
                        <xs:sequence>
                            <xs:element name="masv">
                                <xs:simpleType>
                                    <xs:restriction base="xs:string">
                                        <xs:pattern value="sv[0-9]{2}"/>
                                    </xs:restriction>
                                </xs:simpleType>
                            </xs:element>
                            <xs:element name="tensv" type="xs:string"/>
                            <xs:element name="gioitinh">
                                <xs:simpleType>
                                    <xs:restriction base="xs:string">
                                        <xs:pattern value="Nam|Nu"/>
                                    </xs:restriction>
                                </xs:simpleType>
                            </xs:element>
                            <xs:element name="malop">
                                <xs:simpleType>
                                    <xs:restriction base="xs:string">
                                        <xs:pattern value="[A-Z]{4}[0-9]{2}"/>
                                    </xs:restriction>
                                </xs:simpleType>
                            </xs:element>
                            <xs:element name="diem" type="xs:integer"/>
                        </xs:sequence>
                    </xs:complexType>
                </xs:element>
            </xs:sequence>
        </xs:complexType>
    </xs:element>
</xs:schema>
